{
  "$schema": "https://json-schema.org/draft/2020-12/schema",
  "$id": "scenario.schema.json",
  "title": "02_scenario.json — 정규화된 시나리오",
  "description": "sLLM이 채우는 유일한 구조체. 이후 단계는 이 스키마만 신뢰한다.",
  "type": "object",
  "required": ["case_id", "stage", "schema_version", "generated_at", "generator", "target_os", "techniques", "time_range", "entities", "overall_confidence", "unmapped_text"],
  "additionalProperties": false,
  "properties": {
    "case_id": { "type": "string", "pattern": "^[A-Za-z0-9][A-Za-z0-9_-]*$" },
    "stage": { "const": "02_normalize" },
    "schema_version": { "const": "1.0" },
    "generated_at": { "type": "string", "pattern": "^\\d{4}-\\d{2}-\\d{2}T\\d{2}:\\d{2}:\\d{2}(\\.\\d+)?Z$" },
    "generator": {
      "type": "string",
      "minLength": 1,
      "description": "모델명과 양자화 수준까지 기록한다. 결과 파일만 보고 실험 조건을 복원할 수 있어야 모델별 비교가 가능하다."
    },
    "target_os": { "enum": ["windows", "linux"] },
    "techniques": {
      "type": "array",
      "minItems": 1,
      "description": "빈 배열은 스키마 위반이다. 기법을 하나도 못 뽑았다면 선별할 것이 없으므로 뒤 단계를 돌릴 이유가 없다. errors.jsonl에 기록 후 중단한다.",
      "items": {
        "type": "object",
        "required": ["id", "name", "confidence", "evidence_text"],
        "additionalProperties": false,
        "properties": {
          "id": {
            "type": "string",
            "pattern": "^T\\d{4}(\\.\\d{3})?$",
            "description": "형식만 본다. 실재하는 기법인지는 src/common/attack.py가 별도로 검사한다. 두 오류를 나눠 집계해야 '존재하지 않는 ATT&CK ID 생성' 비율이 따로 나온다."
          },
          "name": { "type": "string", "minLength": 1 },
          "confidence": { "type": "number", "minimum": 0.0, "maximum": 1.0 },
          "evidence_text": {
            "type": "string",
            "description": "입력 원문 중 해당 기법을 판단한 근거 구간. 오분류 원인 추적에 필수."
          }
        }
      }
    },
    "time_range": {
      "type": "object",
      "required": ["start", "end", "basis"],
      "additionalProperties": false,
      "properties": {
        "start": { "type": "string", "pattern": "^\\d{4}-\\d{2}-\\d{2}T\\d{2}:\\d{2}:\\d{2}(\\.\\d+)?Z$" },
        "end": { "type": "string", "pattern": "^\\d{4}-\\d{2}-\\d{2}T\\d{2}:\\d{2}:\\d{2}(\\.\\d+)?Z$" },
        "basis": {
          "type": "string",
          "description": "시간 범위를 어떻게 추론했는지. 범위가 틀렸을 때 원인이 드러난다."
        }
      }
    },
    "entities": {
      "type": "object",
      "required": ["hosts", "paths", "processes", "accounts", "ips"],
      "additionalProperties": false,
      "properties": {
        "hosts": { "type": "array", "items": { "type": "string" } },
        "paths": { "type": "array", "items": { "type": "string" } },
        "processes": { "type": "array", "items": { "type": "string" } },
        "accounts": { "type": "array", "items": { "type": "string" } },
        "ips": { "type": "array", "items": { "type": "string" } }
      }
    },
    "overall_confidence": { "type": "number", "minimum": 0.0, "maximum": 1.0 },
    "unmapped_text": {
      "type": "array",
      "items": { "type": "string" },
      "description": "기법으로 매핑하지 못한 서술. 매핑 테이블의 결손 지점을 찾는 데이터."
    }
  }
}
